Category	id	question_main	question_var1	question_var2	question_var3	answer	
Troubleshooting	trbl-002	Can RabbitLoader fix slow image loading?	Does RabbitLoader resolve slow image load times?	How does RabbitLoader address slow images?	Will RabbitLoader speed up my site’s images?	Yes — RabbitLoader helps fix slow image loading by compressing images, converting them to next-gen formats like WebP or AVIF, applying lazy loading, and delivering them through its global CDN for faster performance.	
Troubleshooting	trbl-003	Can RabbitLoader help if my CSS breaks?	Does RabbitLoader fix CSS issues?	How does RabbitLoader handle CSS conflicts?	Will RabbitLoader resolve my broken CSS?	Yes — RabbitLoader safely minifies and optimizes CSS, but if a conflict occurs, you can adjust exclusions or check CSS optimization settings in the RabbitLoader console.	
Troubleshooting	trbl-004	Can RabbitLoader fix slow first load?	Does RabbitLoader improve initial page load?	How does RabbitLoader address slow first loads?	Will RabbitLoader speed up my site’s first load?	Yes — RabbitLoader can speed up slow first loads by caching pages on its CDN, optimizing images and scripts, inlining critical CSS, and minimizing render-blocking resources.	
Troubleshooting	trbl-005	How does RabbitLoader handle plugin compatibility?	Is RabbitLoader compatible with other WordPress plugins?	Does RabbitLoader provide settings to ensure plugin compatibility?		Yes — RabbitLoader provides options to exclude specific scripts or styles from optimizationhelping prevent conflicts with other plugins while still improving site performance.	
Troubleshooting	trbl-006	Can RabbitLoader fix missing fonts?	Does RabbitLoader resolve font loading issues?	How does RabbitLoader handle missing fonts?	Will RabbitLoader ensure my fonts load correctly?	Yes — RabbitLoader can resolve missing font issues by preloading and caching fonts, ensuring they load quickly and consistently across all pages.	
Troubleshooting	trbl-007	Can RabbitLoader fix mixed content errors?	Does RabbitLoader resolve mixed content issues?	How does RabbitLoader handle HTTPS mismatches?	Will RabbitLoader fix my site’s mixed content?	Yes — RabbitLoader can fix mixed content errors by making sure all optimized assets (images, CSS, and JavaScript) are served over HTTPS to match your site’s secure protocol.	
Troubleshooting	trbl-008	Can RabbitLoader fix broken images after optimization?	Does RabbitLoader resolve image optimization issues?	How does RabbitLoader handle broken images?	Will RabbitLoader fix images that break after optimization?	Yes — RabbitLoader helps resolve image optimization issues by properly optimizing and caching images through its CDN. If problems occur, you can exclude specific images from optimization in the settings in the RabbitLoader console → Settings → Page Rules or Following this https://rabbitloader.com/account/#rules.	
Troubleshooting	trbl-009	Can RabbitLoader help with redirect loops?	Does RabbitLoader fix redirect loop issues?	How does RabbitLoader handle redirect problems?	Will RabbitLoader resolve my site’s redirect loops?	Yes — RabbitLoader can help prevent redirect loops by caching pages correctly and allowing you to exclude specific URLs from caching or optimization that might cause conflicts.	
Troubleshooting	trbl-010	Can RabbitLoader help if my site score drops?	Does RabbitLoader fix declining PageSpeed scores?	How does RabbitLoader address dropping site scores?	Will RabbitLoader improve my site’s performance score?	Yes — RabbitLoader can help improve your site’s score if it drops by optimizing images, minifying code, reducing render-blocking resources, and delivering content through its global CDN to enhance PageSpeed and Core Web Vitals.	
Troubleshooting	trbl-011	Can RabbitLoader be disabled without uninstalling?	Does RabbitLoader allow temporary disabling?	How to turn off RabbitLoader without removing it?	Can I pause RabbitLoader’s optimization?	Yes — you can temporarily disable RabbitLoader without uninstalling it. Simply go to the RabbitLoader plugin dashboard, navigate to Settings, and click Disconnect from RabbitLoader.	
							
							
							
							
				   			