Category	id	question_main	question_var1	question_var2	question_var3	answer	
Code Optimization	code-008	Does RabbitLoader remove unused CSS?	Can RabbitLoader eliminate unused CSS?	How does RabbitLoader handle unused CSS removal?	Will RabbitLoader strip out unnecessary CSS?	Yes — RabbitLoader can remove unused CSS, keeping only the styles needed for each page to reduce file size and improve loading speed.	
Code Optimization	code-009	Does RabbitLoader load CSS inline?	Can RabbitLoader inline CSS for faster loading?	How does RabbitLoader handle inline CSS?	Will RabbitLoader embed CSS in my HTML?	Yes — RabbitLoader can inline critical CSS directly into the HTML, ensuring above-the-fold content loads quickly without waiting for external stylesheets.	
Code Optimization	code-010	Can RabbitLoader optimize fonts?	Does RabbitLoader speed up font loading?	How does RabbitLoader handle font optimization?	Will RabbitLoader improve my site’s font performance?	Yes — RabbitLoader can optimize fonts by preloading themreducing render-blocking delaysand caching them on its CDN.	
Code Optimization	code-011	Does RabbitLoader reduce render-blocking resources?	Can RabbitLoader minimize render-blocking scripts?	How does RabbitLoader handle render-blocking assets?	Will RabbitLoader fix render-blocking issues?	Yes — RabbitLoader reduces render-blocking resources by minifying and deferring non-critical CSS/JavaScriptand by generating critical CSS so above-the-fold content loads first.	
Code Optimization	code-012	Can RabbitLoader preload important resources?	Does RabbitLoader support resource preloading?	How does RabbitLoader handle preloading assets?	Will RabbitLoader preload my site’s critical resources?	Yes — RabbitLoader can preload important resources like fontscritical CSSand above-the-fold images. Preloading tells the browser to fetch these assets earlierso they’re ready when neededreducing load time and improving user experience.	
Code Optimization	code-014	Does RabbitLoader support HTTP/2 multiplexing?	Can RabbitLoader use HTTP/2 for faster delivery?	How does RabbitLoader handle HTTP/2 multiplexing?	Will RabbitLoader leverage HTTP/2 features?	Yes — RabbitLoader supports HTTP/2 multiplexing, allowing multiple resources to be loaded simultaneously over a single connection for faster delivery.	
Code Optimization	code-015	Can RabbitLoader optimize third-party scripts?	Does RabbitLoader handle third-party script optimization?	How does RabbitLoader manage external scripts?	Will RabbitLoader speed up third-party scripts?	Yes — RabbitLoader can defer and lazy-load third-party scripts like analyticsadsand social widgets so they don’t block rendering or delay interaction.	
Code Optimization	code-016	Does RabbitLoader support predictive preloading?	Can RabbitLoader preload predicted pages?	How does RabbitLoader handle predictive preloading?	Will RabbitLoader anticipate my site’s navigation?	Yes — RabbitLoader supports predictive preloadingwhich anticipates the pages a user is likely to visit next and preloads them in the backgroundmaking navigation feel instant.	
Code Optimization	code-017	Can RabbitLoader reduce unused JS?	Does RabbitLoader eliminate unused JavaScript?	How does RabbitLoader handle unused JS reduction?	Will RabbitLoader strip out unnecessary JavaScript?	Yes — RabbitLoader can help reduce unused JavaScript by delaying non-critical scriptsremoving unnecessary ones from the initial loadand optimizing how JS is delivered so only essential code runs early.	
Code Optimization	code-018	Does RabbitLoader support critical CSS?	Can RabbitLoader generate critical CSS?	How does RabbitLoader handle critical CSS?	Will RabbitLoader inline critical CSS for my site?	Yes — RabbitLoader automatically generates and inlines critical CSS to speed up above-the-fold content rendering and reduce render-blocking stylesheets.	
Code Optimization	code-019	Can RabbitLoader prefetch internal links?	Does RabbitLoader preload internal page links?	How does RabbitLoader handle internal link prefetching?	Will RabbitLoader speed up my site’s navigation?	Yes — RabbitLoader can prefetch internal links loading resources for the next pages in advance to make navigation faster and smoother for users.	
Code Optimization	code-020	Can RabbitLoader exclude scripts from optimization?	Does RabbitLoader allow skipping script optimization?	How does RabbitLoader handle script exclusions?	Will RabbitLoader bypass optimization for specific scripts?	Yes — RabbitLoader allows you to exclude specific scripts from optimization or deferment. You can manage this by adding them to the exclusion list under Page Rules in the RabbitLoader console or directly via: https://rabbitloader.com/account/#rules	
Code Optimization	code-021	Can RabbitLoader optimize video delivery?	Does RabbitLoader speed up video loading?	How does RabbitLoader handle video optimization?	Will RabbitLoader improve my site’s video performance?	Yes — RabbitLoader can optimize video delivery by lazy-loading embedded videos (YouTubeVimeo) and serving them only when visiblereducing initial page load time.	
Code Optimization	code-022	Does RabbitLoader help with DNS preconnect?	Can RabbitLoader implement DNS preconnect?	How does RabbitLoader handle DNS preconnection?	Will RabbitLoader speed up third-party connections?	Yes — RabbitLoader can implement DNS preconnect for third-party domains allowing the browser to resolve domain names early and speed up resource loading.	
Code Optimization	code-023	Can RabbitLoader load Google Fonts faster?	Does RabbitLoader optimize Google Fonts?	How does RabbitLoader handle Google Fonts loading?	Will RabbitLoader speed up my Google Fonts?	Yes — RabbitLoader optimizes Google Fonts by preloading, caching, and serving them efficiently, which reduces font load time and improves overall page rendering speed.	
Compatibility	comp-001	Does RabbitLoader work with any hosting?	Is RabbitLoader compatible with shared hosting?	Can I use RabbitLoader with VPS or cloud hosting?	Will RabbitLoader work on my dedicated server?	Yes — RabbitLoader works with all hosting providers. Since it functions through a CDN and optimization layer, it is fully compatible with shared hosting, VPS, cloud hosting, and dedicated servers.	
Compatibility	comp-002	Does RabbitLoader support HTTP/3?	Is RabbitLoader compatible with HTTP/3?	Can RabbitLoader use HTTP/3 for faster delivery?	Does RabbitLoader support modern HTTP protocols?	Yes — RabbitLoader supports HTTP/3allowing faster and more reliable content delivery with reduced latency compared to older HTTP versions.	
Compatibility	comp-003	Does RabbitLoader support AMP pages?	Can RabbitLoader optimize AMP websites?	Is RabbitLoader compatible with Accelerated Mobile Pages?	Will RabbitLoader work with my AMP site?	No — RabbitLoader does not currently support AMP (Accelerated Mobile Pages) specificallyas AMP uses a different optimization framework.	
Compatibility	comp-004	Does RabbitLoader support custom CDN subdomains?	Can I use my own CDN subdomain with RabbitLoader?	Is custom CDN subdomain supported by RabbitLoader?	How does RabbitLoader handle custom CDN domains?	No — RabbitLoader does not currently support custom CDN subdomains; it uses its own global CDN domains to deliver assets.	
Compatibility	comp-005	Does RabbitLoader integrate with Cloudflare?	Can RabbitLoader work alongside Cloudflare?	Is RabbitLoader compatible with Cloudflare’s CDN?	How does RabbitLoader function with Cloudflare?	Yes — RabbitLoader integrates smoothly with Cloudflare. You only need to configure caching and optimization settings properly to prevent conflicts between the two services. know more: https://rabbitloader.com/kb/cloudflare-settings-for-best-performance/	
Compatibility	comp-006	Can RabbitLoader work with multi-CDN setups?	Does RabbitLoader support multiple CDNs?	Is RabbitLoader compatible with multi-CDN configurations?	How does RabbitLoader handle multi-CDN environments?	No — RabbitLoader is designed to use its own built-in CDN and does not natively support multi-CDN configurations.	
Image Optimization	img-001	Does RabbitLoader optimize images?	Can RabbitLoader make my images load faster?	How does RabbitLoader handle image optimization?	Will RabbitLoader compress my website’s images?	RabbitLoader automatically optimizes images by compressing them without visible quality loss and converting them to next-gen formats like WebP or AVIF. This reduces file sizeimproves loading speedand boosts Core Web Vitals without you having to manually edit your images.	
Image Optimization	img-002	Can RabbitLoader convert images to WebP?	Does RabbitLoader support WebP conversion?	How does RabbitLoader handle WebP images?	Will RabbitLoader change my images to WebP format?	Yes — RabbitLoader can automatically convert images to WebP (and AVIF) without compromising quality. This greatly reduces file sizes, speeds up page loading, and enhances SEO performance.	
Image Optimization	img-003	Does RabbitLoader support AVIF format?	Can RabbitLoader convert images to AVIF?	Is AVIF image format supported by RabbitLoader?	How does RabbitLoader handle AVIF images?	Yes — RabbitLoader supports the AVIF format and can automatically convert compatible images to AVIF, delivering smaller file sizes and faster loading times.	
Image Optimization	img-004	Does RabbitLoader compress images without losing quality?	Can RabbitLoader reduce image size without quality loss?	How does RabbitLoader ensure lossless image compression?	Will RabbitLoader maintain image quality during compression?	Yes — RabbitLoader compresses images in a lossless or near-lossless way, reducing file sizes while preserving their original visual quality.	
Image Optimization	img-005	Can RabbitLoader resize images?	Does RabbitLoader adjust image dimensions?	How does RabbitLoader handle image resizing?	Will RabbitLoader scale my website’s images?	Yes — RabbitLoader can automatically resize images to the optimal dimensions for each device, improving load times and reducing bandwidth usage.	
Image Optimization	img-006	Does RabbitLoader lazy load images?	Can RabbitLoader delay image loading?	How does RabbitLoader implement lazy loading for images?	Will RabbitLoader lazy load my site’s images?	Yes — RabbitLoader lazy loads images, loading them only when they enter the viewport to speed up initial page load.	
Image Optimization	img-007	Can I exclude images from optimization?	Is it possible to skip image optimization in RabbitLoader?	How to prevent RabbitLoader from optimizing specific images?	Does RabbitLoader allow excluding images from compression?	Yes — RabbitLoader lets you exclude specific images from optimization by adding them to the exclusion list in its settings.	
Image Optimization	img-008	Does RabbitLoader optimize background images?	Can RabbitLoader compress background images?	How does RabbitLoader handle background image optimization?	Will RabbitLoader optimize my site’s background images?	Yes — RabbitLoader can optimize background images by compressing them and converting them to next-gen formats like WebP or AVIF.	
Image Optimization	img-009	Can RabbitLoader serve different formats to different browsers?	Does RabbitLoader deliver browser-specific image formats?	How does RabbitLoader handle image format compatibility?	Will RabbitLoader adjust image formats based on browser?	Yes — RabbitLoader can serve images in different formats (like WebP or AVIF) based on the visitor’s browser support, ensuring optimal performance for each user.	
Image Optimization	img-010	Does RabbitLoader optimize images in CSS?	Can RabbitLoader compress CSS-linked images?	How does RabbitLoader handle CSS image optimization?	Will RabbitLoader optimize images used in CSS?	Yes — RabbitLoader can optimize images referenced in CSS, such as background images, by compressing them and converting them to next-gen formats.	
Image Optimization	img-011	Can RabbitLoader serve images via CDN?	Does RabbitLoader deliver images through its CDN?	How does RabbitLoader use CDN for images?	Will RabbitLoader cache images on its CDN?	RabbitLoader serves images through its global CDN. This means images are delivered from the server closest to the visitorreducing latency and improving load speed. Combined with image optimizationthis makes page loading much faster.	
Image Optimization	img-012	Does RabbitLoader use image placeholders?	Can RabbitLoader implement image placeholders?	How does RabbitLoader handle image placeholders?	Will RabbitLoader add placeholders for images?	Yes — RabbitLoader can use image placeholders (like blurred or low-quality previews) while the full image loads, improving perceived page speed.	
Image Optimization	img-013	Can RabbitLoader optimize SVGs?	Does RabbitLoader compress SVG images?	How does RabbitLoader handle SVG optimization?	Will RabbitLoader reduce SVG file sizes?	Yes — RabbitLoader can optimize SVG files by cleaning up unnecessary code and reducing file size without affecting quality.	
Image Optimization	img-014	Does RabbitLoader handle animated GIFs?	Can RabbitLoader optimize animated GIFs?	How does RabbitLoader process animated GIFs?	Will RabbitLoader compress my animated GIFs?	Yes — RabbitLoader handles animated GIFs by converting them to lighter formats like WebP or compressing them to reduce file size while preserving the animation.	
Installation & Setup	setup-001	How do I install RabbitLoader on WordPress?	Steps to integrate RabbitLoader with WordPress.	How to set up RabbitLoader plugin?	RabbitLoader setup for WP site?	Download and install the RabbitLoader plugin from WordPress.org, activate it, and follow the Instalation guide: https://www.youtube.com/watch?v=W-jYelvWE0I.	
Installation & Setup	setup-002	Does RabbitLoader require coding skills?	Can I set up RabbitLoader without coding?	Is coding needed to use RabbitLoader?	How to use RabbitLoader without programming knowledge?	No — RabbitLoader does not require coding skills. It’s designed to be plug-and-play: install the plugin or add the integration scriptand it automatically handles optimization without manual coding.See tutorial: https://www.youtube.com/watch?v=W-jYelvWE0I.	
Installation & Setup	setup-003	Can RabbitLoader work without a plugin?	Is a plugin required for RabbitLoader?	Can I use RabbitLoader on non-WordPress sites?	How to set up RabbitLoader without a plugin?	Yes — RabbitLoader can work without a plugin by adding its integration script directly to your website’s code. This is useful for non-WordPress or custom-built sites.	
Performance Concepts	perf-001	Why is website loading speed important?	Does page speed affect SEO?	How does speed impact user experience?	Why should I care about my site’s load time?	Website loading speed is crucial because faster sites enhance user engagement, lower bounce rates, and improve SEO performance. Since Google includes Core Web Vitals in its ranking factors, a faster website can directly help boost search visibility.	
Performance Concepts	perf-002	What are Core Web Vitals?	Explain LCP, CLS, and INP.	What metrics does Google use for site performance?	How to check my Core Web Vitals?	Core Web Vitals are a set of key performance metrics defined by Google to measure user experience on websites. They include LCP,CLS, and INP. RabbitLoader is designed to optimize and improve all three of these metrics.	
Performance Concepts	perf-003	Can RabbitLoader improve mobile speed?	Does RabbitLoader make mobile sites load faster?	How does RabbitLoader enhance mobile performance?	Will RabbitLoader speed up my site on mobile networks?	Yes — RabbitLoader can improve mobile speed by serving optimized imagescompressing filesreducing render-blocking resourcesand delivering content via its CDNensuring fast loading even on slower mobile networks.	
Performance Concepts	perf-004	Can RabbitLoader improve Core Web Vitals?	Does RabbitLoader optimize LCP, FID and CLS?	How does RabbitLoader enhance Core Web Vitals?	Will RabbitLoader boost my site’s performance metrics?	Yes — RabbitLoader can improve Core Web Vitals like: LCP (Largest Contentful Paint) → faster image & font loadingFID (First Input Delay) → reduced render-blocking scriptsCLS (Cumulative Layout Shift) → better resource loading order.	
Performance Concepts	perf-005	Can RabbitLoader improve LCP?	Does RabbitLoader optimize Largest Contentful Paint?	How does RabbitLoader enhance LCP performance?	Will RabbitLoader reduce my site’s LCP time?	Yes — RabbitLoader can improve Largest Contentful Paint (LCP) by optimizing images, fonts, and critical resources to load faster.	
Performance Concepts	perf-006	Can RabbitLoader reduce CLS?	Does RabbitLoader minimize Cumulative Layout Shift?	How does RabbitLoader improve CLS scores?	Will RabbitLoader stabilize my site’s layout?	Yes — RabbitLoader helps reduce Cumulative Layout Shift (CLS) by reserving space for images, fonts, and other elements to prevent unexpected page shifts.	
Performance Concepts	perf-007	Can RabbitLoader improve TBT?	Does RabbitLoader reduce Total Blocking Time?	How does RabbitLoader optimize TBT performance?	Will RabbitLoader enhance my site’s TBT?	Yes — RabbitLoader can improve Total Blocking Time (TBT) by optimizing JavaScript execution, deferring non-critical scripts, and reducing render-blocking resources.	
Performance Concepts	perf-008	Can RabbitLoader reduce FCP time?	Does RabbitLoader speed up First Contentful Paint?	How does RabbitLoader improve FCP performance?	Will RabbitLoader make my site’s first paint faster?	Yes — RabbitLoader can reduce FCP time by preloading critical resources, optimizing images, and delivering cached content through its CDN, ensuring the first visible elements load more quickly.	
Performance Concepts	perf-009	Can RabbitLoader improve interaction delays?	Does RabbitLoader reduce FID or INP?	How does RabbitLoader enhance interaction performance?	Will RabbitLoader make my site respond faster?	Yes — RabbitLoader can reduce interaction delays (such as FID and INP) by minimizing render-blocking scripts, optimizing JavaScript execution, and prioritizing critical resources to ensure faster user responsiveness.	
Performance Concepts	perf-010	Can RabbitLoader boost Google PageSpeed score?	Does RabbitLoader improve PageSpeed Insights scores?	How does RabbitLoader enhance Google PageSpeed?	Will RabbitLoader increase my site’s PageSpeed score?	Yes — RabbitLoader can boost your Google PageSpeed score by optimizing images, minimizing render-blocking resources, compressing files, enabling lazy loading, leveraging its CDN, and enhancing Core Web Vitals	
Performance Concepts	perf-011	Does RabbitLoader improve Lighthouse scores?	Can RabbitLoader enhance my Lighthouse performance?	How does RabbitLoader affect Lighthouse results?	Will RabbitLoader boost my site’s Lighthouse score?	Yes — RabbitLoader can improve Lighthouse scores by optimizing Core Web Vitals, reducing page size, compressing images, minifying CSS/JS, and improving server response times.	
Performance Concepts	perf-012	Can RabbitLoader improve mobile scores?	Does RabbitLoader boost mobile PageSpeed scores?	How does RabbitLoader optimize mobile performance?	Will RabbitLoader enhance my site’s mobile metrics?	Yes — RabbitLoader can boost mobile PageSpeed scores by optimizing images, compressing files, reducing render-blocking code, and delivering assets through its global CDN for faster performance on mobile networks.	
Performance Concepts	perf-013	Can RabbitLoader fix render-blocking issues?	Does RabbitLoader eliminate render-blocking resources?	How does RabbitLoader handle render-blocking fixes?	Will RabbitLoader resolve my site’s render-blocking problems?	Yes — RabbitLoader helps fix render-blocking issues by inlining critical CSS for instant above-the-fold loading, deferring non-essential JavaScript until after the page is visible, and minifying CSS/JS to reduce file sizes.	
Performance Concepts	perf-014	Can RabbitLoader preload above-the-fold images?	Does RabbitLoader prioritize above-the-fold images?	How does RabbitLoader handle above-the-fold image loading?	Will RabbitLoader speed up my above-the-fold images?	Yes — RabbitLoader can preload above-the-fold images, ensuring they load instantly as the page opens, which improves Largest Contentful Paint and enhances user experience.	
Performance Concepts	perf-015	Can RabbitLoader improve server response time?	Does RabbitLoader reduce server load time?	How does RabbitLoader optimize server responses?	Will RabbitLoader speed up my server’s response?	Yes — RabbitLoader improves server response time by delivering cached pages and assets directly from its CDN, reducing the need for repeated server processing.	
Product Overview & Benefits	prod-001	What does RabbitLoader do?	How does RabbitLoader work?	Explain RabbitLoader in simple terms.	Why should I use RabbitLoader?	RabbitLoader speeds up your website by optimizing images, caching pages, reducing script size, and delivering content through a global CDN to improve Core Web Vitals.	
Product Overview & Benefits	prod-002	What is RabbitLoader?	How does RabbitLoader work?	What does RabbitLoader do for websites?	Explain RabbitLoader’s purpose in simple terms.	RabbitLoader is a website speed optimization tool that combines a global CDNimage optimizationcachinglazy loadingand code minification to improve page load timesCore Web Vitalsand Google PageSpeed scores — all without requiring coding skills.	
Product Overview & Benefits	prod-003	Is RabbitLoader a CDN?	Does RabbitLoader include a CDN?	How does RabbitLoader’s CDN work?	Is RabbitLoader only a CDN?	RabbitLoader is not just a CDNbut it includes a built-in global CDN as part of its optimization system.	
Product Overview & Benefits	prod-004	Does RabbitLoader affect site design?	Will RabbitLoader change my website’s appearance?	Can RabbitLoader alter my site’s layout?	Does RabbitLoader modify how my site looks?	No — RabbitLoader does not change your site’s design. It simply optimizes the delivery of assets (images, CSS, JS, and fonts) to improve loading speed while preserving the exact look and layout of your website.	
Security	sec-001	Does RabbitLoader support HTTPS?	Is RabbitLoader compatible with secure websites?	Can RabbitLoader deliver content over HTTPS?	Does RabbitLoader ensure secure asset delivery?	Yes — RabbitLoader fully supports HTTPS and ensures that all optimized assets are delivered securely via its CDN.	
Security	sec-002	Is RabbitLoader GDPR compliant?	Does RabbitLoader follow GDPR regulations?	Is RabbitLoader safe for user data?	Can RabbitLoader ensure data privacy compliance?	Yes — RabbitLoader is GDPR compliant, adhering to data protection regulations and ensuring that no personal data is collected or stored without user consent.	
SEO Impact	seo-001	How does RabbitLoader affect SEO rankings?	Will using RabbitLoader help my site rank higher?	Does speed optimization improve search results?	Can RabbitLoader boost my Google position?	RabbitLoader enhances site speed and Core Web Vitals, both of which are key Google ranking factors, thereby indirectly boosting your website’s SEO performance.	
SEO Impact	seo-002	Does RabbitLoader improve SEO?	Can RabbitLoader boost my site’s search rankings?	How does RabbitLoader affect SEO performance?	Will RabbitLoader help my website rank higher on Google?	Yes — RabbitLoader helps improve SEO by increasing site speed, optimizing Core Web Vitals, reducing bounce rates, and delivering optimized images and code.	
Supported Platforms	plat-001	Which platforms does RabbitLoader support?	Can I use RabbitLoader on Shopify?	Does RabbitLoader work with WordPress?	Is RabbitLoader compatible with custom-built sites?	RabbitLoader supports WordPress, Shopify, and custom-built websites. Integration guides for each platform are available in the following https://rabbitloader.com/kb/category/getting-started/ to help you get started easily.	
Supported Platforms	plat-002	What platforms does RabbitLoader support?	Can I use RabbitLoader with WordPress or Shopify?	Is RabbitLoader compatible with Joomla or Drupal?	Does RabbitLoader work on custom-built websites?	RabbitLoader supports all major platformsincluding: WordPress (via plugin)Shopify (via app)Custom websites (via SDK)Platforms .  Integration guides for each platform are available in the following https://rabbitloader.com/kb/category/getting-started/ to help you get started easily.	
Supported Platforms	plat-003	Can RabbitLoader work with WooCommerce?	Is RabbitLoader compatible with WooCommerce stores?	Does RabbitLoader optimize WooCommerce sites?	How does RabbitLoader support WooCommerce?	Yes — RabbitLoader works seamlessly with WooCommerce by optimizing product images, scripts, and styles, while ensuring smooth caching for dynamic pages. It also speeds up the checkout process without breaking cart functionality. Learn more here: WooCommerce Speed Optimization	
Troubleshooting	trbl-001	Why are my images not optimized after installing RabbitLoader?	RabbitLoader not optimizing images, what to do?	Images still loading slow with RabbitLoader?	How to fix image optimization issues in RabbitLoader?	If your images are not optimized after installing RabbitLoader, ensure that the plugin is active, caching is enabled, and your images are in supported formats. Try clearing the cache and re-checking performance. Also, review your optimization settings in the RabbitLoader console → Settings → Page Rules or Following this https://rabbitloader.com/account/#rules to confirm proper configuration.	
